Cliente - Nome,Cliente - CNPJ,Cliente - Estado,Cliente - Cidade,rua,numero,bairro,cep (8 digitos),CONCAT,enderecoFormatado,lat,lng
EQUIMACON LTDA,64268451000278,MG,ITABIRA,R PLATINA,236,MAJOR LAGE DE BAIXO,35.900-217,"R PLATINA, 236, MAJOR LAGE DE BAIXO, ITABIRA","R. Platina, 236 - Maj. Lage de Baixo, Itabira - MG, 35900-217, Brazil",-19.6325229,-43.2283243
HELIO DUTRA CONSTRUCAO E ACABAMENTO LTDA,13731411000107,RJ,TRES RIOS,R PREFEITO JOAQUIM JOSE FERREIRA,188,CENTRO,25.804-020,"R PREFEITO JOAQUIM JOSE FERREIRA, 188, CENTRO, TRES RIOS","R. Pref. Joaquim José Ferreira, 188 - Centro, Três Rios - RJ, 25804-020, Brazil",-22.1176613,-43.2117469
CONSTRUSUL DE RESENDE MAT CONST LTDA ME,14931452000100,RJ,RESENDE,AV DOUTOR SEBASTIAO MOREIRA NETO,235,NOVA RESENDE,27.521-752,"AV DOUTOR SEBASTIAO MOREIRA NETO, 235, NOVA RESENDE, RESENDE","Avenida Doutor Sebastião Moreira Neto, 250 Comercial Nova Resende - Resende, RJ, 27521-752, Brazil",-22.4841841,-44.4921471
MORELLI COMERCIO MAT DE CONSTRUCAO LTDA,94169331000101,RS,ESTRELA,R CEL.BRITO,950,ORIENTAL,95.880-000,"R CEL.BRITO, 950, ORIENTAL, ESTRELA","R. Cel. Brito, 950 - Oriental, Estrela - RS, 95880-000, Brazil",-29.4969763,-51.9571276
CASA UNICA MATERIAIS DE CONSTRUCAO LTDA,25618174000143,MG,BELO HORIZONTE,AV PRESIDENTE CARLOS LUZ,2000,APARECIDA SETIMA SECAO,31.250-810,"AV PRESIDENTE CARLOS LUZ, 2000, APARECIDA SETIMA SECAO, BELO HORIZONTE","Av. Presidente Carlos Luz, 2000 - Alto Caiçaras, Belo Horizonte - MG, 31250-810, Brazil",-19.8916667,-43.9647222
CONSTRUSCHORR MATERIAIS DE CONSTRUCAO LTDA,689431000107,RS,LAJEADO,RST 453,KM 28,FLORESTA,95.900-010,"RST 453, KM 28, FLORESTA, LAJEADO","Rodovia RST 453, Km 28, s/n - Floresta, Lajeado - RS, 95900-000, Brazil",-29.4752407,-52.0088157
TAKARA TAKARA IRMAO LTDA,60836244000130,SP,SAO PAULO,AV ITABERABA,3844,ITABERABA,02.739-000,"AV ITABERABA, 3844, ITABERABA, SAO PAULO","Av. Itaberaba, 3844 - Itaberaba, São Paulo - SP, 02739-000, Brazil",-23.4771355,-46.6802104
ULETE MOTTA E CIA LTDA,24231276000149,MG,JOAO MONLEVADE,AV GETULIO VARGAS,5166,CARNEIRINHOS,35.930-003,"AV GETULIO VARGAS, 5166, CARNEIRINHOS, JOAO MONLEVADE","Av. Getúlio Vargas, 5166 - Nossa Sra. da Conceicao, João Monlevade - MG, 35930-001, Brazil",-19.8078867,-43.1772514
MUD MATERIAIS DE CONSTRUCAO LTDA,33082249000142,RJ,RIO DE JANEIRO,R MARQUES DE SAO VICENTE,9,GAVEA,22.451-041,"R MARQUES DE SAO VICENTE, 9, GAVEA, RIO DE JANEIRO","R. Marquês de São Vicente, 9 - Gávea, Rio de Janeiro - RJ, 22451-041, Brazil",-22.9751506,-43.2269209
ADFER MATS DE CONSTR LTDA,29092269000127,RJ,PETROPOLIS,EST UNIAO E INDUSTRIA,10.959,ITAIPAVA,25.730-740,"EST UNIAO E INDUSTRIA, 10959, ITAIPAVA, PETROPOLIS","Estr. União e Indústria, 10959 - Itaipava, Petrópolis - RJ, 25730-740, Brazil",-22.394377,-43.1324135
CONSTRU RIBEIRO COM MAT CONST,55953582000112,SP,BARRETOS,AV MATO GROSSO,695,BELA VISTA,14.780-735,"AV MATO GROSSO, 695, BELA VISTA, BARRETOS","Av. Mato Grosso, 695 - Bela Vista, Barretos - SP, 14780-735, Brazil",-20.5452276,-48.56786049999999
APOIO RBS COMERCIAL LTDA,2381476000145,SP,PERUIBE,AV LUCIANO DE BONA,1930,PARQUE TURISTICO,11.750-000,"AV LUCIANO DE BONA, 1930, PARQUE TURISTICO, PERUIBE","Av. Luciano de Bona, 1930 - Vila Peruibe, Peruíbe - SP, 11750-000, Brazil",-24.281386,-46.95965700000001
PEDRAO PVC MATS P CONSTR LTDA,60344348000128,SP,RIBEIRAO PRETO,R MARTINICO PRADO,897,VILA TIBERIO,14.050-050,"R MARTINICO PRADO, 897, VILA TIBERIO, RIBEIRAO PRETO","R. Martinico Prado, 897 - Vila Tiberio, Ribeirão Preto - SP, 14050-050, Brazil",-21.1676671,-47.8199281
ESTORIL NITEROI MATS CONSTR LTDA ME,91673000102,RJ,NITEROI,R PRESIDENTE BACKER,188,ICARAI,24.220-041,"R PRESIDENTE BACKER, 188, ICARAI, NITEROI","R. Pres. Backer, 188 - Icaraí, Niterói - RJ, 24220-041, Brazil",-22.9031442,-43.1095723
SCHUMACHER AREIAS E ARGAMASSAS LTDA,7236044000164,SC,CANOINHAS,"ROD BR 280 KM 221,7",2650,AGUA VERDE,89.460-000,"ROD BR 280 KM 221,7, 2650, AGUA VERDE, CANOINHAS","BR-280 - Água Verde, Canoinhas - SC, Brazil",-26.189878,-50.3757229
MONFORTE MAT DE CONSTRUCOES LTDA - ME,42000737000154,BA,SALVADOR,AV CENTENARIO,1369,CENTENARIO,40.155-150,"AV CENTENARIO, 1369, CENTENARIO, SALVADOR","Salvador - State of Bahia, Brazil",-12.9777334,-38.501648
S S MATERIAL DE CONSTRUCAO LTDA,15112858000115,SE,ARACAJU,R OSVANDA OLIVEIRA VIEIRA,168,PEREIRA LOBO,49.050-550,"R OSVANDA OLIVEIRA VIEIRA, 168, PEREIRA LOBO, ARACAJU","R. Osvanda Oliveira Vieira, 168 - Pereira Lobo, Aracaju - SE, 49050-550, Brazil",-10.924592,-37.070084
REALEZA MATERIAIS DE CONSTRUCAO LTDA,4047818000110,SC,ITAPOA,R DO COMERCIO,326,BAL ITAPEMA DO NORTE,89.249-000,"R DO COMERCIO, 326, BAL ITAPEMA DO NORTE, ITAPOA","Av. Emílio Cornelsen, Itapoá - SC, 89249-000, Brazil",-26.0670135,-48.6076183
SALOMAO ANTONIO E CIA LTDA EPP,4898102000127,PA,BELEM,AV MAGALHAES BARATA,379,SAO BRAZ,66.630-040,"AV MAGALHAES BARATA, 379, SAO BRAZ, BELEM","Av. Gov. Magalhães Barata, 379 - São Brás, Belém - PA, 66040-170, Brazil",-1.4517733,-48.47714449999999
THEAGO SEVERINO DE ALMEIDA EIRELI,2402707000150,SP,JALES,AV SALUSTIANO PUPIM,1062,JARDIM GUARANI,15.704-344,"AV SALUSTIANO PUPIM, 1062, JARDIM GUARANI, JALES","Av. Salustiano Pupim, 1062 - Jardim Sao Francisco de Assis, Jales - SP, 15704-344, Brazil",-20.2835048,-50.5540482
CASA MODELO MATS P CONSTR LTDA ME,12904774000126,SP,SAO PAULO,AV JOAO XXIII,700,VILA FORMOSA,03.361-000,"AV JOAO XXIII, 700, VILA FORMOSA, SAO PAULO","Av. João XXIII, 700 - Vila Formosa, São Paulo - SP, 03361-000, Brazil",-23.5729588,-46.5345041
DAGNONI E SEDREZ LTDA - ME,17896653000101,SC,ITAJAI,AV SETE DE SETEMBRO,1581,FAZENDA,88.301-201,"AV SETE DE SETEMBRO, 1581, FAZENDA, ITAJAI","Av. Sete de Setembro, 1581 - Fazenda, Itajaí - SC, 88301-205, Brazil",-26.9195548,-48.6537505
FERRAGENS BUARQUE DE MACEDO LTDA,3963122000171,RJ,RIO DE JANEIRO,R BUARQUE DE MACEDO,73,FLAMENGO,22.220-030,"R BUARQUE DE MACEDO, 73, FLAMENGO, RIO DE JANEIRO","R. Buarque de Macedo, 73 - Flamengo, Rio de Janeiro - RJ, 22220-030, Brazil",-22.928746,-43.1764663
FMA GROFF MADEIREIRA LTDA,93394021000110,RS,PORTO ALEGRE,AV TRAMANDAI,657,IPANEMA,90.001-970,"AV TRAMANDAI, 657, IPANEMA, PORTO ALEGRE","Av. Tramandaí, 657 - Ipanema, Porto Alegre - RS, 91760-050, Brazil",-30.1358779,-51.2271408
JARDIM BOTANICO MATERIAIS DE CONSTRUCAO BAZAR E TINTAS EIRELI,33389263000193,RJ,RIO DE JANEIRO,R JARDIM BOTANICO,145,GAVEA,22.470-050,"R JARDIM BOTANICO, 145, GAVEA, RIO DE JANEIRO","R. Jardim Botânico, 145 - Jardim Botânico, Rio de Janeiro - RJ, 22470-050, Brazil",-22.9606888,-43.2067723
LUZANA COM DE FERRO E METAIS LTDA  ME,40455123000131,RJ,RIO DE JANEIRO,R DOIS DE MAIO,198,SAMPAIO,20.961-160,"R DOIS DE MAIO, 198, SAMPAIO, RIO DE JANEIRO","R. Dois de Maio, 198 - Sampaio, Rio de Janeiro - RJ, 20961-160, Brazil",-22.8995936,-43.2636192
PEDRINHO COMERCIO E SERVICOS PARA CONSTRUCOES EIRELI,2792081000135,SP,BOTUCATU,R DELPHIM DA GRACA CARDOSO,224,VILA OPERARIA,18.604-405,"R DELPHIM DA GRACA CARDOSO, 224, VILA OPERARIA, BOTUCATU","R. Delfim da Graça Cardoso, 224 - Vila Mariana, Botucatu - SP, 18611, Brazil",-22.8781075,-48.4307598
CRG LOJA DE FERRAGENS LTDA,11864257000108,SP,ITAPECERICA DA SERRA,ROD JOSE SIMOES LOURO JUNIOR,5000,CRISPIM,06.865-800,"ROD JOSE SIMOES LOURO JUNIOR, 5000, CRISPIM, ITAPECERICA DA SERRA","Rod. José Simões Louro Júnior, 5000 - Crispim, Itapecerica da Serra - SP, 06865-800, Brazil",-23.7535364,-46.7896456
COMERCIO E INDUSTRIA SCHADECK S/A,85378503002606,SC,PAPANDUVA,R PRESIDENTE NEREU RAMOS,3135,CENTRO,89.370-000,"R PRESIDENTE NEREU RAMOS, 3135, CENTRO, PAPANDUVA","R. Nereu Ramos, 3135 - Centro, Papanduva - SC, 89370-000, Brazil",-26.407717,-50.1424298
MADEIREIRA A J REIS LTDA - EPP,87201109000175,RS,ELDORADO DO SUL,AV GETULIO VARGAS,123,CENTRO,92.990-000,"AV GETULIO VARGAS, 123, CENTRO, ELDORADO DO SUL","Av. Getúlio Vargas, 123 - Centro, Eldorado do Sul - RS, 92990-000, Brazil",-29.9997424,-51.3056992
SJL MATERIAL DE CONSTRUCAO LTDA,30817464000156,RJ,PETROPOLIS,EST UNIAO E INDUSTRIA,SN,ITAIPAVA,25.730-735,"EST UNIAO E INDUSTRIA, SN, ITAIPAVA, PETROPOLIS","Itaipava, Petrópolis - State of Rio de Janeiro, Brazil",-22.3819684,-43.1321582
LUMIERE COML LTDA,4889707000151,PA,BELEM,TV MAURITI,1097,PEDREIRA,66.083-000,"TV MAURITI, 1097, PEDREIRA, BELEM","Tv. Mauriti, 1097 - Pedreira, Belém - PA, 66080-650, Brazil",-1.4266881,-48.4732207
NEITZKE E CIA LTDA,95429148000152,RS,SINIMBU,AV GENERAL FLORES DA CUNHA,571,CENTRO,96.890-000,"AV GENERAL FLORES DA CUNHA, 571, CENTRO, SINIMBU","Av. Gen. Flôres da Cunha, 571, Sinimbu - RS, 96890-000, Brazil",-29.5370576,-52.5191694
7 OLIVEIRAS DISTRIBUIDORA LTDA,25048171000111,SP,SAO PAULO,R HARRY DANNEMBERG,362,VILA CARMOSINA,08.270-010,"R HARRY DANNEMBERG, 362, VILA CARMOSINA, SAO PAULO","Rua Harry Dannemberg, 362 - Vila Carmosina, São Paulo - SP, 08270-010, Brazil",-23.5533998,-46.4640129
DEP CACULA JACAREI MATS PARA CONST LTDA,50467885000101,SP,JACAREI,R JOAO AMERICO DA SILVA,204,CENTRO,12.315-310,"R JOAO AMERICO DA SILVA, 204, CENTRO, JACAREI","R. João Américo Silva, 204 - Centro, Jacareí - SP, 12308-660, Brazil",-23.3075486,-45.9678119
LOEF E CIA LTDA,89901185000119,RS,SAO SEBASTIAO DO CAI,AV DOUTOR BRUNO CASSEL,1173,VILA PROGRESSO,95.760-000,"AV DOUTOR BRUNO CASSEL, 1173, VILA PROGRESSO, SAO SEBASTIAO DO CAI","Av. Dr. Bruno Cassel, 1173, São Sebastião do Caí - RS, 95760-000, Brazil",-29.5780815,-51.3621373
COMERCIAL LUZITANO DA PARADA LTDA,52766904000126,SP,SAO PAULO,AV CANTIDIO SAMPAIO,1400,VILA SOUZA,08.210-040,"AV CANTIDIO SAMPAIO, 1400, VILA SOUZA, SAO PAULO","Av. Dep. Cantídio Sampaio, 1400 - Vila Souza, São Paulo - SP, 02880-070, Brazil",-23.4656265,-46.6793133
GILBERTO F. DOS PASSOS COMERCIO DE MATERIAIS DE CONSTRUCAO EIRELI,94380904000133,RS,SANTA CRUZ DO SUL,AV GASPAR BARTOLOMAY,854,BOM JESUS,96.815-555,"AV GASPAR BARTOLOMAY, 854, BOM JESUS, SANTA CRUZ DO SUL","Av. Gaspar Bartholomay, 854 - Bom Jesus, Santa Cruz do Sul - RS, 96845-496, Brazil",-29.7263496,-52.4443341
DEPOSITO DE MATERIAIS PARA CONSTRUCAO SAO FRANCISCO DE ASSIS LTDA,44774677000152,SP,CAMPINAS,R CORONEL ALFREDO AUGUSTO DO NASCIMENTO,115,SOUSAS,13.106-000,"R CORONEL ALFREDO AUGUSTO DO NASCIMENTO, 115, SOUSAS, CAMPINAS","R. Cel Alfredo Augusto do Nascimento, 115 - Sousas, Campinas - SP, 13106-000, Brazil",-22.8788822,-46.96458639999999
CENTER FERRAGENS ITAIM PAULISTA LIMITADA ME,64795776000128,SP,SAO PAULO,R MANOEL BUENO DA FONSECA,7,ITAIM PAULISTA,08.121-000,"R MANOEL BUENO DA FONSECA, 7, ITAIM PAULISTA, SAO PAULO","R. Manuel Bueno da Fonseca, 7 - Jardim Sao Luis (Zona Leste), São Paulo - SP, 08121-000, Brazil",-23.4949752,-46.3884894
A VALERIO BRITO,4845539000100,AM,MANAUS,AV ALVARO BOTELHO MAIA,945,SAO GERALDO,69.053-350,"AV ALVARO BOTELHO MAIA, 945, SAO GERALDO, MANAUS","Av Boulevard, 945 - São Geraldo, Manaus - AM, 69053-350, Brazil",-3.1157141,-60.02440559999999
SLIMP DISTRIBUIDORA DE MATERIAIS DE CONSTRUCAO EIRELI,13128503000199,RS,SANTA CRUZ DO SUL,AC LINHA JOAO ALVES,SN,BELVEDERE,96.825-390,"AC LINHA JOAO ALVES, SN, BELVEDERE, SANTA CRUZ DO SUL","Linha João Alves, 1010 - Loteamento Terra Vista - Country, Santa Cruz do Sul - RS, Brazil",-29.7150398,-52.39485320000001
DALBEM MAT ELET HIDRAULICOS FER E FERRAMENTAS EIRELI EPP,1339641000138,SP,PAULINIA,R DOM PAULO DE TARSO CAMPOS,141,VILA BRESSANI,13.140-492,"R DOM PAULO DE TARSO CAMPOS, 141, VILA BRESSANI, PAULINIA","Rua Dom Paulo Tarso Campos, 141 - Vila Bressani, Paulínia - SP, 13140-492, Brazil",-22.7704685,-47.1543462
AS MAT CONST LTDA,31819139000195,ES,VILA VELHA,R DR. ANTONIO ATAIDE,1845,DIVINO ESP.SANTO,29.107-200,"R DR. ANTONIO ATAIDE, 1845, DIVINO ESP.SANTO, VILA VELHA","R. Antônio Ataíde, 1845 - Centro de Vila Velha, Vila Velha - ES, 29100-295, Brazil",-20.3462368,-40.2933207
TECHFIX COM PROD FIX LTDA,7084548000106,PA,BELEM,AV PEDRO MIRANDA,2037,PEDREIRA,66.085-024,"AV PEDRO MIRANDA, 2037, PEDREIRA, BELEM","Av. Pedro Miranda, 2037 - Pedreira, Belém - PA, 66085-024, Brazil",-1.422209,-48.468461
SANTEC COM DE FERRAGENS E FERRAMENTAS LTDA,51322782000116,SP,DESCALVADO,R SIQUEIRA CAMPOS,344,CENTRO,13.690-000,"R SIQUEIRA CAMPOS, 344, CENTRO, DESCALVADO","R. Siqueira Campos, 344 - Centro, Descalvado - SP, 13690-000, Brazil",-21.9051698,-47.6247294
CARLOS DANIEL FAVARO BOZI CD COM VAREJ DE MAT DE CONSTRUCAO,34487240000184,ES,VITORIA,R PEDRO CARLOS DE SOUZA,84,ILHA DE SANTA MARIA,29.051-052,"R PEDRO CARLOS DE SOUZA, 84, ILHA DE SANTA MARIA, VITORIA","R. Pedro Carlos de Souza, 84 - Ilha de Santa Maria, Vitória - ES, 29051-050, Brazil",-20.3170953,-40.3203879
ALDO CESAR BATISTA ME,5272696000129,PR,CURITIBA,AV VICENTE MACHADO,2619,BATEL,80.440-020,"AV VICENTE MACHADO, 2619, BATEL, CURITIBA","Av. Vicente Machado, 2619 - Batel, Curitiba - PR, 80440-020, Brazil",-25.4433361,-49.30072089999999
DEPOSITO DE MADEIRA SAO LUIZ LTDA,44604973000105,SP,CAMPINAS,AV ARMANDO SALES OLIVEIRA,390,TAQUARAL,13.090-150,"AV ARMANDO SALES OLIVEIRA, 390, TAQUARAL, CAMPINAS","Avenida Doutor Armando Sáles de Oliveira, 390 - Taquaral, Campinas - SP, 13076-015, Brazil",-22.8785587,-47.0491907
ARMAZEM CORAL LTDA,11623188001031,PE,RECIFE,AV DOMINGOS FERREIRA,4811,BOA VIAGEM,51.021-000,"AV DOMINGOS FERREIRA, 4811, BOA VIAGEM, RECIFE","Av. Domingos Ferreira, 4811 - Boa Viagem, Recife - PE, 51021-040, Brazil",-8.1295105,-34.9018401
PADOVANI PADOVANI LTDA,50223692000458,SP,ITU,R PARQUE DO VARVITO,100,ALTO,13.310-161,"R PARQUE DO VARVITO, 100, ALTO, ITU","Rua Parque do Varvito, 100 - Parque Res. Mayard, Itu - SP, 13311, Brazil",-23.2664272,-47.3159219
CASA DAS TINTAS DE ANAPOLIS LTDA,33229030000204,GO,ANAPOLIS,AV BRASIL SUL,317,JUNDIAI,75.123-020,"AV BRASIL SUL, 317, JUNDIAI, ANAPOLIS","Av. Brasil Sul, 317 - Cidade Jardim, Anápolis - GO, 75080-240, Brazil",-16.3318535,-48.9509596
AGRO BOI IMP E EXP LTDA,4119970001052,RO,PORTO VELHO,AV PREFEITO CHIQUILITO ERSE,746,LAGOA,76.812-034,"AV PREFEITO CHIQUILITO ERSE, 746, LAGOA, PORTO VELHO","Av. Pref. Chiquilito Erse, 746 - Agenor M. de Carvalho, Porto Velho - RO, 76812-034, Brazil",-8.7704138,-63.8719683
IMPERMS COMERCIO DE TINTAS E IMPERMEABILIZANTES LTDA,8218450000167,MS,CAMPO GRANDE,AV MANOEL DA COSTA LIMA,1879,JARDIM PIRATININGA,79.081-040,"AV MANOEL DA COSTA LIMA, 1879, JARDIM PIRATININGA, CAMPO GRANDE","Av. Manoel da Costa Lima, 1867 - Vila Piratininga, Campo Grande - MS, 79081-040, Brazil",-20.4982986,-54.6338392
COTRIPAL AGROPECUARIA COOP,91982496001920,RS,PANAMBI,R GASPAR MARTINS,355,CENTRO,98.280-000,"R GASPAR MARTINS, 355, CENTRO, PANAMBI","R. Gáspar Martins, 355 - Centro, Panambi - RS, 98280-000, Brazil",-28.2857926,-53.4983984
MANFRIN CASSEB E CIA LTDA,72739543001027,SP,CATANDUVA,AV ENGENHEIRO JOSE NELSON MACHADO,1213,JARDIM SOTO,15.810-185,"AV ENGENHEIRO JOSE NELSON MACHADO, 1213, JARDIM SOTO, CATANDUVA","Av. Eng. José Nelson Machado, 1213 - Parque Iracema, Catanduva - SP, 15800-000, Brazil",-21.1468229,-48.9745845
CASA VERDE MATERIAIS PARA CONSTRUCAO LTDA,52912748000679,SP,BRAGANCA PAULISTA,ESTM VEREADOR ALVARO ALESSANDRI,84,CAMPO NOVO,12.903-841,"ESTM VEREADOR ALVARO ALESSANDRI, 84, CAMPO NOVO, BRAGANCA PAULISTA","Estr. Mun. Ver. Alvaro Alessandri, 84 - Campo Novo, Bragança Paulista - SP, 12903-841, Brazil",-22.9485676,-46.5934695
CDVIP COMERCIO E DISTRIBUICAO DE MATERIAIS DE CONSTR LTDA,10994854000194,SP,SAO PEDRO,R ELPIDIO FERRAZ DE ALMEIDA,28,JARDIM SANTA ROSA,13.520-000,"R ELPIDIO FERRAZ DE ALMEIDA, 28, JARDIM SANTA ROSA, SAO PEDRO","R. Elpidio Ferraz de Almeida, São Pedro - SP, 13520-000, Brazil",-22.5755345,-47.8946841
AGRO BOI IMPORTACAO E EXPORTACAO LTDA,4119970000595,AC,RIO BRANCO,AV CEARA,3795,7 BEC,69.918-108,"AV CEARA, 3795, 7 BEC, RIO BRANCO","Avenida Nações Unidas, n° 2100, 7° BEC - Estacao Experimental, Rio Branco - AC, 69918-093, Brazil",-9.9660005,-67.825732
SOLDAMAQ COM DE FERRAMENTAS LTDA,924845001145,MS,CAMPO GRANDE,AV ZILA CORREA MACHADO,9082,RITA VIEIRA,79.062-002,"AV ZILA CORREA MACHADO, 9082, RITA VIEIRA, CAMPO GRANDE","Av. Zilá Corrêa Machado, 9082 - Rita Vieira, Campo Grande - MS, 79040-400, Brazil",-20.516419,-54.563621
A 3 COMERCIO DE MATERIAIS DE CONSTRUCAO LTDA,13700697000155,PR,FRANCISCO BELTRAO,AV DOM AGOSTINHO JOSE SARTORI,2887,SAO CRISTOVAO,85.601-400,"AV DOM AGOSTINHO JOSE SARTORI, 2887, SAO CRISTOVAO, FRANCISCO BELTRAO","Av. Dom Agostinho José Sartori, 2887 - São Cristovao, Francisco Beltrão - PR, 85601-400, Brazil",-26.0950648,-53.0479192
COFERMETA SA,17281973001382,MG,CONTAGEM,R MANOEL PEREIRA MENDES,333,CINCO,32.010-040,"R MANOEL PEREIRA MENDES, 333, CINCO, CONTAGEM","R. Manoel Pereira Mendes, 333 - Cinco, Contagem - MG, 32010-040, Brazil",-19.9361046,-44.0775893
COPAFER COML LTDA,55728224000106,SP,SANTO ANDRE,AV DOS ESTADOS,4555,SANTA TEREZINHA,09.210-580,"AV DOS ESTADOS, 4555, SANTA TEREZINHA, SANTO ANDRE","Av. dos Estados, 4555 - Parque Central, Santo André - SP, 09210-580, Brazil",-23.6435516,-46.5310056
MILBLOCOS MATERIAL DE CONSTRUCAO EIRELI,35958339000180,ES,CARIACICA,AV CARIACICA,204,VILA CAPIXABA,29.148-100,"AV CARIACICA, 204, VILA CAPIXABA, CARIACICA","Av. Cariacica, 204 - Vila Capixaba, Cariacica - ES, 29148-100, Brazil",-20.3348144,-40.3998566
ARLINDO CARREIRA CIA LTDA,55019012000150,SP,LEME,AV DOUTOR JAMBEIRO COSTA,1755,CENTRO,13.610-236,"AV DOUTOR JAMBEIRO COSTA, 1755, CENTRO, LEME","Av. Dr. Jambeiro Costa, 1755 - Jardim Sao Jose, Leme - SP, 13610-236, Brazil",-22.2032388,-47.3921534
YARALIAN E MURAYAMA LTDA,8024864000155,SP,PRESIDENTE PRUDENTE,AV BRASIL,2298,JARDIM BELA DARIA,19.013-001,"AV BRASIL, 2298, JARDIM BELA DARIA, PRESIDENTE PRUDENTE","Av. Brasil, 2298 - Jardim Bela Daria, Pres. Prudente - SP, 19013-001, Brazil",-22.1385741,-51.3913304
PANORAMA MATERIAIS DE CONSTRUCAO LTDA,1711005000608,PR,FOZ DO IGUACU,AV COSTA E SILVA PARQUE PRESIDENTE/JARDIM CLAUDIA/CR1/JARDIM IT,3300,CAMPOS DO IGUACU,85.852-282,"AV COSTA E SILVA PARQUE PRESIDENTE/JARDIM CLAUDIA/CR1/JARDIM IT, 3300, CAMPOS DO IGUACU, FOZ DO IGUACU","Av. Costa e Silva - Parque Pres. 1, Foz do Iguaçu - PR, 85863-000, Brazil",-25.5161531,-54.5552126
NICOM COMERCIO DE MATERIAIS PARA CONSTRUCOES LTDA,60403110000630,SP,SAO PAULO,R DOUTOR ABELARDO VERGUEIRO CESAR,2,VILA ALEXANDRIA,04.635-080,"R DOUTOR ABELARDO VERGUEIRO CESAR, 2, VILA ALEXANDRIA, SAO PAULO","Rua Dr. Abelardo Vergueiro Cesar, 2 - Vila Alexandria, São Paulo - SP, 04635-080, Brazil",-23.635742,-46.6683543
SUVINENSE DE CAMPOS TINTAS LTDA,6049974000650,RJ,CAMPOS DOS GOYTACAZES,AV 24 DE OUTUBRO,87,PARQUE TARCISIO MIRANDA,28.024-600,"AV 24 DE OUTUBRO, 87, PARQUE TARCISIO MIRANDA, CAMPOS DOS GOYTACAZES","Av. 24 de Outubro, 87 - Parque Tarcisio Miranda, Campos dos Goytacazes - RJ, 28024-600, Brazil",-21.77792,-41.306892
PREMOLNITOS MATERIAIS DE CONSTRUCAO LTDA,9436414000132,PE,PETROLINA,AV DA INTEGRACAO AYRTON SENNA (LOTEAMENTO CIDADE JARDIM),1010,MARIA AUXILIADORA,56.330-290,"AV DA INTEGRACAO AYRTON SENNA (LOTEAMENTO CIDADE JARDIM), 1010, MARIA AUXILIADORA, PETROLINA","Av. da Integração - Maria Auxiliadora, Petrolina - PE, Brazil",-9.3862469,-40.4963918
LIGIA CONCEICAO DO AMARAL LIMA,24009197000511,SP,LENCOIS PAULISTA,AV PREFEITO JACOMO NICOLAU PACCOLA,500,PARQUE RESIDENCIAL RONDON,18.685-099,"AV PREFEITO JACOMO NICOLAU PACCOLA, 500, PARQUE RESIDENCIAL RONDON, LENCOIS PAULISTA","Av. Pref. Jácomo Nicolau Paccola, 500 - Parque Res. Rondon, Lençóis Paulista - SP, 18685-136, Brazil",-22.5866129,-48.8093112
COAMO AGROINDUSTRIAL COOPERATIVA,75904383003228,PR,CAMPO MOURAO,R PIONEIRO ADINOR CORDEIRO DE SOUZA,780,JARDIM SILVANA,87.309-730,"R PIONEIRO ADINOR CORDEIRO DE SOUZA, 780, JARDIM SILVANA, CAMPO MOURAO","R. Pioneiro Adinor Cordeiro de Souza, 780 - Jardim Modelo, Campo Mourão - PR, 87301-640, Brazil",-23.9944606,-52.3555686
IMPORTADORA OPLIMA LTDA,4945481000169,PA,BELEM,R MUNICIPALIDADE,1157,TELEGRAFO,66.050-350,"R MUNICIPALIDADE, 1157, TELEGRAFO, BELEM","R. Municipalidade, 1157 - Umarizal, Belém - PA, 66050-350, Brazil",-1.438307,-48.4905188
L JARDIM E CIA LTDA,12270435000488,AL,MACEIO,AV FERNANDES LIMA,991-B,FAROL,57.055-000,"AV FERNANDES LIMA, 991-B, FAROL, MACEIO","Av. Fernandes Lima, 991 - Farol, Maceió - AL, 57055-000, Brazil",-9.6422,-35.7357828
FERRAMENTAS GERAIS COMERCIO E IMPORTACAO DE FERRAMENTAS E MA,92664028002780,RS,NOVO HAMBURGO,ROD RS-239,1199,OPERARIO,93.352-700,"ROD RS-239, 1199, OPERARIO, NOVO HAMBURGO","RS-239, 1199 - São José, Novo Hamburgo - RS, 93352, Brazil",-29.6611828,-51.1323575
POLITINTAS LTDA,27171883001473,ES,CARIACICA,R TREZE,419,MARACANA,29.142-866,"R TREZE, 419, MARACANA, CARIACICA","R. Treze, 419 - Maracanã, Cariacica - ES, 29142-868, Brazil",-20.3596006,-40.3745346
SR ACABAMENTOS E MAT P CONSTR LTDA,26443804000159,DF,BRASILIA,ST SIA TRECHO 1,S/N,ZONA INDUSTRIAL (GUARA),71.200-010,"ST SIA TRECHO 1, S/N, ZONA INDUSTRIAL (GUARA), BRASILIA","S/n - SIA Trecho 1 - Guará, Brasília - DF, 71200-010, Brazil",-15.8069815,-47.9613518
FERRAGEM LORENZET LTDA,88318456000145,RS,PELOTAS,AV ENGENHEIRO ILDEFONSO SIMOES LOPES,500,TRES VENDAS,96.060-290,"AV ENGENHEIRO ILDEFONSO SIMOES LOPES, 500, TRES VENDAS, PELOTAS","Av. Engenheiro Ildefonso Simões Lopes, 500 - Tres Vendas, Pelotas - RS, 96060-290, Brazil",-31.7355855,-52.323842
AC COELHO MAT CONST LTDA,37083474000154,DF,BRASILIA,"TR SIA TRECHO 3, LOTES 1010/1060/1070/1080/1090/1100/1110/1120",SN,SETOR DE INDUSTRIA E ABASTECIMENTO,71.200-030,"TR SIA TRECHO 3, LOTES 1010/1060/1070/1080/1090/1100/1110/1120, SN, SETOR DE INDUSTRIA E ABASTECIMENTO, BRASILIA","SIA Trecho 3 - SIA - Guará, Brasília - DF, 70297-400, Brazil",-15.8019025,-47.9649708
JAGUAR COM DE TINTAS LTDA,7221472000113,CE,FORTALEZA,AV CORONEL CARVALHO,2731,JARDIM IRACEMA,60.341-630,"AV CORONEL CARVALHO, 2731, JARDIM IRACEMA, FORTALEZA","Av. Cel. Carvalho, 2731 - Barra do Ceará, Fortaleza - CE, 60341-641, Brazil",-3.7270798,-38.5852197
